cod,numero_caso,descripcion,area_resolutor,estado
1767,1903,Invitada comunica que en la madrugada del 14/05 estuvo jugando en Lucky Ladys Charm Deluxe y al momento de abrirle los juegos gratis el juego se paralizo en plena atracción. Y que hoy consulto con su ejecutiva y le indico que el juego abriría de forma automática cuando vuelva a ingresar. Se verifica en el sistema y se observa lo siguiente: Invitada realiza su ultima jugada: *40924948   14/05/2021 03:05:21 AM    Lucky Ladys Charm Deluxe  apuesta de  -2.00 soles Invitada ingresa a las: *40923122    14/05/2021 04:53:57 AM   Sizzling Hot Deluxe   premio  de 4.00 soles Invitada ingresa a las:  *40924948    14/05/2021 05:19:50 AM  Lucky Ladys Charm Deluxe  premio de 33.40 soles Se informa a la invitada que al momento que volvió a ingresar al juego  las 05:19 am este cargo su premio de las jugadas gratis y que si no vio las jugadas fue por un problema de conexión. Invitada indica que no le parece el premio ya que es una apuesta de 2 soles y que ella quiere ver las jugadas y que le habían indicado que al momento de ingresar el juego se reanudaría y que le parece una estafa. Se reitera la información a la invitada explicándole que su premio fue cargado y lo puede ver el HISTORIAL  de la pagina. Se adjunta imagen de ALIRA y las que compartió la invitada.,SOPORTE,CERRADO
1768,1904,Ejecutiva brindo apoyo a invitada para realizar su primer depósito para casino online. Invitada indica que entendió que la recarga era para el físico // por lo que solicitaba la devolución de su dinero. Con autorización de Francisco Subiria se hizo la devolución de la recarga // en el casino físico // por medio de un vale. Se procedió a inactivar la cuenta a solicitud de invitada // en la cuenta online aún se encuentran los s/200.00 de la recarga.,CONTROL Y GESTION - FINANZAS - SOPORTE,CERRADO
1769,1905,Se denegó el retiro a invitada por incumplir TyC de retiro.  Invitada desea retirar el monto de s/15.000 (confirmándolo por llamada)  //se le informó que las solicitudes ingresadas anteriormente fueron denegadas ya que no cumplió con los TYC de la plataforma  //pero indica ya perdió mucho y que además tiene una emergencia de salud y necesita urgente el dinero. Desea le brinden las facilidades para poder realizar su retiro.   Se adjunta imagen de correo. ,CONTROL Y GESTION - SOPORTE,CERRADO
1770,1906,*Mozilla/ 5.0 (Linux 10 // Android 10 // Redmi Note 8 Pro) AppleWebkit/537.36  *Celular con wifi invitado indica que atraccion le brindó 12 juegos gratis // él estaba apostando S/4 // luego de ello la pantalla se congelo  // volvió a ingresar al juego pero indica que no aparecieron los juegos. Visualizamos a las 23:38:40pm una apuesta de S/4 en dicho juego // y a las  23:39:09pm el juego otorga un premio de S/2. Se explica este último movimiento del juego // pero él no está seguro en el rango de horario // sólo sabe que fue una de sus últimas jugadas y no desea aceptar que juego haya pagado esa cantidad. Pide que  revisen si ello realmente corresponde a sus 12 juegos gratis que nunca jugó. Se adjunta imagen de Alira ,CONTROL Y GESTION - SOPORTE,CERRADO
1771,1907,Invitada se comunica puesto que no puede ingresar a la plataforma para jugar ha intentado con varios // Solar king - Noble Sky y la pantalla se pone en negro // intento desde otro navegador // desde su laptop y celular y la plataforma no le permite jugar. ,CONTROL Y GESTION - OPERACIONES TI - SOPORTE,CERRADO
1772,1908,Juego: Yeh Hsien Invitado indica que realizó dos apuestas de S/1.50 y una apuesta de S/1.00. máquina se lagueó y se consumió su saldo solo. Se verifica en alira dos apuesta de S/37.50 y una de S/25.00. invitado molesto atina a insultar indicando que le han robado y quiere que se haga la devolución de su saldo.  Se verifica en juego que al darle monto de S/1.50 en "bet per line" automáticamente aparece "total bet" S/37.50 Lo mismo ocurre cuando se le da S/1.00 "bet per line" se muestra S/25.00 en "total bet".  Se detalló esta información a invitado // pero indica que el sabe de sistemas y lo hemos hecho // es robarle.  se adjunta foto de alira. ,CONTROL Y GESTION - SOPORTE,CERRADO
1773,1909,20:26 horas:  Invitado solicita vía correo el cierre de su cuenta pero se verifica que tiene un saldo de S/. 1.50 soles y se informa al invitado (por el mismo medio) que su saldo debe estar en S/. 0.00 soles. 21:08 horas:  Invitado responde vía correo que su saldo ya esta en S/.0.10 centavos y que procedamos al cierre de su cuenta. Se adjunta imágenes de los correos.,SOPORTE,CERRADO
1774,1910,Invitada desea el cierre de su cuenta ya que tuvo problemas al realizar depósitos e indica siempre pierde su dinero. Se contactó previamente por correo indicando que su cuenta debe estar en 0 ya que tenía un monto de $0.15. Se verifica su cuenta ya está en 0.  Se adjunta imagen de correo y Alira. ,SOPORTE,CERRADO
1775,1911,Cliente no reconoce las transacciones visibles en su cuenta bancaria correspondientes al día sábado 15 y domingo 16 de mayo realizadas a la plataforma de Atlantic City.  Cabe resaltar // que invitado el dia Viernes 14 de mayo al promediar 19hrs // intento realizar una recarga en su cuenta con el monto de S/. 200 con su tarjeta VISA BCP // la cual fue rechazada por la plataforma.,FINANZAS - SOPORTE,CERRADO
1776,1912,Invitada indica que no realizò las 3 apuestas de 100 soles cada una  // en total 300 soles . Ya que venia jugando de 0.40 cèntimos. Pueden ver el historial y mantiene el mismo monto de apuesta  // Solicita que porfavor se le considere ya que es primera vez y no es muy tecnòlogica. alias: ESCORPIONA dìa: 16/05 Hora: 11:20 pm Equipo: Computadora Conexiòn directa ,CONTROL Y GESTION - SOPORTE,CERRADO
1777,1913,INVITADO DESEA ANULAR SU CUENTA YA QUE HA SIDO CONTRATADO POR OTRO CASINO PARA REALIZAR TRASMICIONES EN VIVO Y NO DESEA RECIBIR PUBLICIDAD // NO LLAMADAS // NO MENSAJES DE TEXTOS // NO CORREOS DE PARTE DE NOSOTROS.,VENTAS - SOPORTE,CERRADO
1778,1914,Invitado envía correo // indicando que desea nuevamente reactivar su cuenta.   Se adjunta imagen del correo. ,SOPORTE,CERRADO
1779,1915,Cliente menciona // que estaba jugando y cuando se le acabo el saldo solo pudo depositar 200 soles. Lo que sucedio fue que el sr. estaba jugando la apuesta de 100 o 98 soles // pero sucede que en el total bet sale 4.50 soles y cuando le abre la atraccion con una apuesta que el sr. no reconoce le paga 57 soles // en ese mismo momento se produce un error de conexion y el sr. se queda sin saldo y no puede retomar el juego. Se adjunta fotos que brinda el cliente.  Celular: samsung conexion wifi navegador chrome,CONTROL Y GESTION - VENTAS - SOPORTE,CERRADO
1780,1916,Invitado se comunica vía llamada telefónica indicando que a realizado un deposito de 50 dólares y que no le aparece en su cuenta // se informa al invitado que la transacción no ha sido validada por que  su cuenta es en soles y su deposito es en otra moneda y que lo podemos ayudar realizándole la devolución de su dinero el día de mañana a partir de las 08:00 am. Invitado se molesta por que le ha llegado un mensaje donde le indica "que se va duplicar su deposito sea en dólares o soles". Se informa al invitado que el mensaje pertenece a la promocion de bienvenida o duplica pero que el mensaje abierto por que es para todos los invitados así tenga cuenta en soles o dólares. Se adjunta imagen que compartió el invitado ,FINANZAS - SOPORTE,CERRADO
1781,1917,invitada solicito su retiro antes de que se le brinde el sorteo electrónico // por favor  pide revisar su caso.  codigo promocional BP400PENF8###4be687,DEPORTES - SOPORTE,CERRADO
1782,1918,Invitada comunica que desde ayer (13/05) a realizado varios depósitos y jugado en la maquina Lucky Ladys Charm Deluxe Mobile y que no le ha pagado. Invitada indica que entiende que los juegos son al azar pero no es dable que no pague en un tiempo de aproximadamente 24 horas de juego. Se adjunta imagen de los depósitos de la invitada con fechas 13 y 14 del 05.,CONTROL Y GESTION - SOPORTE,CERRADO
1783,1919,Invitado indica que apuesta 100 soles en mesa de bacarat // invitado saca 6 y banca 5 // invitado indica que sale ganador pero la plataforma solo le devuelve su apuesta,CONTROL Y GESTION,CERRADO
1784,1920,*Mozilla/ 5.0 (Linux 10 // Android 10 // Redmi Note 8 Pro) AppleWebkit/537.36  *Celular con wifi invitado indica que atraccion le brindó 12 juegos gratis // él estaba apostando S/4 // luego de ello la pantalla se congelo  // volvió a ingresar al juego pero indica que no aparecieron los juegos. Visualizamos a las 23:38:40pm una apuesta de S/4 en dicho juego // y a las  23:39:09pm el juego otorga un premio de S/2. Se explica este último movimiento del juego // pero él no está seguro en el rango de horario // sólo sabe que fue una de sus últimas jugadas y no desea aceptar que juego haya pagado esa cantidad. Pide que  revisen si ello realmente corresponde a sus 12 juegos gratis que nunca jugó. Se adjunta imagen de Alira ,CONTROL Y GESTION,CERRADO
1785,1921,Invitada indica que le abrió bonus y le sale mensaje de error // se solicita que cierre sesión y vuelva a ingresar // aún así persiste el inconveniente // se adjunta imagen (intentó desde su laptop y celular) ambos casos en google chrome.,CONTROL Y GESTION,CERRADO
1786,1922,Invitado desea que regularicen sus pagos que ha tenido // dado que le han descontado en su cuenta bancaria y no se ha reflejado en su cuenta Online.,SOPORTE,CERRADO
1787,1923,invitado desea cierre de cuenta Se adjunta correo,SOPORTE,CERRADO
1788,1924,Invitado indica que realizó una apuesta // salió su jugada pero no el pagaron // estaba reclamando porque se había cobrado de su saldo los 126 que apostó // los cuales figuraron después de 10 minutos. Comenta que apostó 9 plenos al 34 en la ruleta // 36*9=324.  celular / wifi / chrome Se adjunta screen de alira. ,CONTROL Y GESTION - OPERACIONES TI - SOPORTE,CERRADO
1789,1925,Invitada sólo cuenta con un depósito realizado el 12/01/2021 por S/100  en donde se le brindó el primer bono de la promoción "Duplica tus 3 primeros depósitos". Indica que últimamente su madre ha estado recibiendo varias promociones como Sorteos y ella no recibe promoción alguna. ¿Se le puede brindar la promoción Duplica tus 3 primeros depósitos ya que aún tiene 2 recargas más para completar la promo? Quedamos a la espera de respuesta. Se adjunta imagen con su primera y única recarga,SOPORTE,CERRADO
1790,1926,Invitada indica que ingresó a juego "Solar Temple" y máquina se encontraba en apuesta de S/.200 // según invitada no verificó apuesta // confió en nosotros y jugó sin darse cuenta hasta que le apareció mensaje "no cuenta con saldo disponible" bajando apuesta a S/.2.80. Invitada pide se reintegre dinero de su efectivo depósitado (S/.2 000) ya que le parece lo más justo porque máquinas estan mal programadas. Se verifica en alira que invitada estuvo jugando juego "Solar Temple" antes de realizar apuestas de S/.200. Luego de inconveniente invitada continua realizando jugadas hasta las 03:34:00 AM y retomó juego a las 10:03:08 AM. (se indicó lo mismo a invitada pero ella insite que se le debe devolver monto que recargó y no monto del total de las 8 apuestas de S/.200 que da un total de S/.1 600 Se comunicó recién por la noche porque indica que se sentía triste al ver que había perdido dinero en apuestas tan altas y ahora ya se siente más calmada. Pese a haber indicado a invitada detalles de sus jugadas y desmentir en ciertos detalles que ella brinda // invitada insiste en que le ingrese reclamo y su caso sea revisado por las personas encargadas.  Se adjunta foto de alira donde se muestra 8 apuestas de S/. 200 ,SOPORTE,CERRADO
1791,1927,VIENE DEL RECLAMO #1915 //  SE CORRIGIÓ SUB TIPO  //  RECABAR LA INFORMACIÓN DEL RECLAMO #1915 ,CONTROL Y GESTION - OPERACIONES TI - SOPORTE,CERRADO
1792,1928,*Mozilla/5.0(Linux // Android 10 // M2006C3MG)AppleWebkit/537.36 (KHTML // like Gecko) *Celular// juega con datos Invitado indica que realizó una apuesta de S/88 el 20/05/2021  a las 22:32:20 y ganó con 9 natural pero paralizaron la jugada y devuelven su apuesta. Indica "todavía colocan el 9 en la banca cuando las cartas claramente se ve que es alreves". Invitado exige que revisen y devuelvan su ganancia.  Se adjunta historial de alira en donde se visualiza la devolución // así como las imágenes enviadas por invitado. ,CONTROL Y GESTION - SOPORTE,CERRADO
1793,1929,Invitada pide por favor le retornen su bono de referido ya que hizo una solicitud de retiro a las 9:13PM y el bono se activó a las 9:58:21PM. Su retiro está en "pendiente" // pero no se le activa la opción "retirar" para que pueda cancelar el retiro y el área encargada ya no se encuentra en tuno para que nos pueda ayudar de manera manual.   Se adjunta imágenes de Alira. ,CONTROL Y GESTION - SOPORTE,CERRADO
1794,1930,Invitado hizo 2 recargas exitosas vía YAPE pero la primera que realizó a las 8:11PM monto: s/105 ( EN CURSO) // se le llegó a debitar // pero no el monto que aparece en Alira (s/105) // en sus movimientos no figura dicho monto  // figura con un monto de s/107. Invitado está molesto y pide devolución de su dinero.  Se adjunta imágenes de Alira. ,OPERACIONES TI - FINANZAS,CERRADO
1795,1931,Invitada sólo cuenta con un depósito realizado el 12/01/2021 por S/100  en donde se le brindó el primer bono de la promoción "Duplica tus 3 primeros depósitos". Indica que últimamente su madre ha estado recibiendo varias promociones como Sorteos y ella no recibe promoción alguna. Consulto como algo interno ¿Se le puede brindar la promoción Duplica tus 3 primeros depósitos ya que aún tiene 2 recargas más para completar la promo?  Se adjunta imagen con su primera y única recarga,DEPORTES - SOPORTE,CERRADO
1796,1932,Invitado solicita cerrar cuenta en soles y aperturar una nueva en dólares  // ya que es el tipo de moneda que maneja al 100% en casíno físico. ,VENTAS - SOPORTE,CERRADO
1797,1933,invitada indica que le salió juego gratis en la maquina y que ese juego le da 15 jugadas siempre y solo le dio 13 ya que le salió error de juego y no se completaron.  Mozilla/5.0 (iPhone // CPU iPhone OS 11_4 like Mac OS X) AppleWebKit/604.1.34 (KHTML // like Gecko) CriOS/76.0.3809.123 Mobile/15E148 Safari/604.1 ,SOPORTE,CERRADO
1798,1934,*Mozilla/5.0 (iPhone // CPU iPhone OS 11_4 like Mac OS X) AppleWebKit/604.1.34 (KHTML // like Gecko) CriOS/76.0.3809.123 Mobile/15E148 Safari/604.1 *Celular // juega con datos. *Se adjunta imagen de Alira con el premio brindado // así como las imágenes de invitada.  El 20/05/2021 a las 14:00:06 // invitada compra un bonus por S/120 // a las 14:02:37 juego brinda ganancia total de S/6000 y le sale mensaje de "Enhorabuena // ha ganado S/6000 por 13 tiradas" el multiplicador total era 518X. A lo que invitada indica que cada vez que compra bonus en dicho juego siempre brinda 15 tiradas. De igual manera // en otra imagen muestra glosa de "Premio máximo S/6000". Invitada queda desconcertada ya indica le falta aún 2 tiradas por jugar // adicional a ello ¿S/6000 es el monto máximo brindado por dicho juego? Indica que no le pueden colocar máximos de ganancia en un juego y que ella conoce el "Gates of Olympus" muy bien ya que lo juega todos los días y sabe que ante un bonus siempre brinda 15 tiradas. Su apoyo con la inquietud de invitada acerca del juego. ,CONTROL Y GESTION - SOPORTE,CERRADO
1799,1935,Invitado solicita adicionar su cuenta BBVA a su perfil del casino // quiere mantener la cuenta BCP // pero quiere que la principal sea la del BBVA porque es mas rápido el retiro. ,FINANZAS - SOPORTE,CERRADO
1800,1936,Invitado solicita dar de baja a su cuenta en soles //ya que desea jugar con una cuenta en dólares. Se ingresa reclamo para su revisión.  Se adjunta correo e imagen de Alira donde se verifica la cuenta en cero. ,SOPORTE,CERRADO
1801,1937,Invitada indica que el juego no le brindo la jugadas correctas ya que ella siempre juega en la misma maquina // le brindo tres jugadas cuando siempre son 15. Lo mismo le paso el día de ayer y tiene un reclamo 1934  // no entiende porque le ponen un monto máximo y no le permite terminar las jugadas.  Mozilla/5.0 (iPhone // CPU iPhone OS 11_4 like Mac OS X) AppleWebKit/604.1.34 (KHTML // like Gecko) CriOS/76.0.3809.123 Mobile/15E148 Safari/604.1 ,CONTROL Y GESTION,CERRADO
1803,1939,Invitado comunica vía llamada telefónica que le ha llegado un correo informándole que tiene una cuenta aperturada con su nombre y que el no ha solicitado ninguna apertura o creado alguna cuenta. Se pregunta al invitado si el correo registrado en el sistema (francoiness@gmail.com) con la cuenta que indica que no es de el // le pertenece // respondiendo que si // pero que están usando sus datos sin su autorización y que es la enamorada de su amigo // se consulta al invitado si tiene el nombre de la persona brindando los siguientes datos: Yamil Dagian Palomares Diaz con DNI 71195729.  Se pide al invitado imagen del correo // fotos de su DNI para verificar y proceder a cerrar su cuenta. Se adjunta imágenes ,SOPORTE,CERRADO
1804,1940,Invitado reclama puesto que se le ofreció el jueves 20 de Mayo // el evento del sábado 22 y había elegido la opción 1. A la fecha no le llego lo ofrecido. ,VENTAS - SOPORTE,CERRADO
1805,1941,Invitada incomoda por juego Diamond strike mobile // indica que el recurrente cuando esta jugando y gana un premio el juego sigue girando por minutos y le aparece un mensaje de error // indica que problema se presenta cada semana // pero recién pudo tomar pruebas de lo acontecido. ,CONTROL Y GESTION,CERRADO
1806,1942,SE ELEVA EL CASO CON MIRNA ,VENTAS,CERRADO
1807,1943,INVITADA SOLICITA COMO SOLUCIÓN QUE SE LE DEVUELVA LOS DEPÓSITOS REALIZADOS DE LOS SIGUIENTES DÍAS: 02-04 // 10-04 // 24-05 // INDICA QUE TODAS LAS COMUNICACIONES LO REALIZA POR WAPP Y ELLA ASUME QUE TODOS ESAS QUEJAS SE HABÍAN CONVERTIDO EN RECLAMOS PERO NO LE OTORGARON UN NÚMERO DE RECLAMO // CUANDO LE COMENTO QUE SIEMPRE LE TIENE QUE ENTREGAR UN NÚMERO DE RECLAMO INVITADO  // INDICA QUE NUNCA LE HAN BRINDADO UN NÚMERO DE RECLAMO PARA LOS CASOS QUE INFORMA A SUS EJECUTIVAS // INDICA QUE EL PROBLEMA SON DE LAS MÁQUINAS DE NOVOMATIC QUE SIEMPRE SE DETIENE Y QUE LA HACEN PERDER DINERO //  INVITADA SOLICITA QUE LE DEVUELVAN EL IMPORTE DE SUS DEPÓSITOS DE LOS DÍAS SEÑALADOS COMO PARTE DE LA SOLUCIÓN //  LOS CASOS A REPORTAR SON DEL MES DE ABRIL EN ADELANTE  //  LOS ÚLTIMOS CASOS CERRADOS POR ERROR EN JUEGO CORRESPONDEN A MARZO 2021  ,CONTROL Y GESTION - OPERACIONES TI - SOPORTE,CERRADO
1808,1944,SE450PENF2###118ba1 - INVITADO REALIZADA UN RETIRO A LAS 04:45PM Y A LAS 04:47PM INGRESA CODIGO DE SORTEO ELECTRONICO // SU RETIRO SE APRUEBA 6:08PM Y SE ANULA BONO DE SORTEO // INVITADO NUEVO // POR FAVOR CONSIDERAR PARA QUE PUEDA JUGAR SU SORTEO ELECTRONICO.,DEPORTES,CERRADO
1809,1945,Invitado indica no estar de acuerdo con los puntos hasta el momento de su TOP 50 (6to s/3000) // ya que indica los puntos no se mueven desde las 5:17PM con 86101 pts // siguió jugando y apostando alto ( s/1000 // s/1400 // s/25 //etc )   y hasta el momento sigue con el mismo puntaje a pesar también de que hay multiplicador X5. Se le indica que los puntos se actualizan dependiendo de lo jugado pero desea se ingrese caso.   Se adjuntan imágenes de invitado y del CRM. ,SOPORTE,CERRADO
1810,1946,Invitada activa bono y solicita retiro // pide se devuelva bono ya que en otras oportunidades le ha pasado lo mismo y se lo han devuelto. se explica a invitada que al solicitar retiro le aparece información // avisando que bono será eliminado al aprobarse retiro.  Invitada omite información e insiste que se le ingrese reclamo.  Se adjunta foto de retiro y bono brindado. ,DEPORTES,CERRADO
1811,1947,Invitada  se comunica por el chat de la plataforma por la promoción campaña de actualización // desea usar el bono pero al momento de ingresarlo en la pagina del casino le aparece el mensaje de "NO EXISTE". Se verifica en el sistema que la cuenta de la invitada es en dólares y el bono es en soles // se explica a la invitada el inconveniente y se indica que se realizara la consulta con el área encargada para darle una solución pronta. Invitada hace presente su incomodidad y brinda la imagen de lo que aparece al momento de canjear su bono.,CONTROL Y GESTION - SOPORTE,CERRADO
1812,1948,Invitada tuvo un retiro antes de que se le brindara sus sorteo electrónico // pide que por favor analicemos su caso.  codigo:  BP300PENF11###565a2e,DEPORTES,CERRADO
1813,1949,Invitado se comunica por medio de correo para indicar que desea la reactivación de su cuenta // menciona que se tomo un descanso solamente.,SOPORTE,CERRADO
1815,1951,Invitado solicita por favor la devolución de su bono. Al solicitar el retiro de su premio Top50 // una vez que este fue aprobado // su bono fue eliminado.   Código promocional: BP2000PENF8###1796db Se adjunta imagen de Alira. ,CONTROL Y GESTION,CERRADO
1816,1952,Invitado reclama por motivo que realizo en dos oportunidades  una apuesta de 4 soles y según evidencia adjunta el juego le pago 451.60 subiendole en el balance el total 997.33 de sin embargo salio error y no se ve reflejado en el sistema ni tampoco el historial // invitado solicita el abono de su premio a su cuenta del casino asi como también  // pide transparencia en el juego ya que no figura en su historial. LAPTOP ASUS. RED:wifi // claro ,CONTROL Y GESTION,CERRADO
1817,1953,Invitado realiza una apuesta de S/ 110 // crupier lanza las cartas // al invitado le toca un total de 8 y a banca un total de 0 // invitado indica que paso varios segundos que la crupier espero y luego continuo otra partida y nunca le pago su apuesta,CONTROL Y GESTION - OPERACIONES TI - SOPORTE,CERRADO
1819,1955,Se recibe correo del invitado solicitando la eliminación de su cuenta bancaria del BBVA indicando que dicha cuenta ya no la va usar mas.  Se adjunta imagen del correo y de la cuenta aprobada ,FINANZAS,CERRADO
1820,1956,Invitado pide que cierren cuenta de manera definitiva y que no acepten la reativación por ningún motivo // indica sufre de ludopatía. Se adjunta correo solitando cierre // así como imagen de Alira donde se visualiza cuenta con 0 saldo.,SOPORTE,CERRADO
1821,1957,Clienta menciona que cuando esta jugando de pronto el juego comienza a correr solo y se vuelve de color gris y esto hace que se termine su saldo. Desea que se revise el juego y arreglen la falla que presenta. Modelo y marca de celular: Samsung S10 Conexion: Datos del Celular Navegador: Chrome,CONTROL Y GESTION - SOPORTE,CERRADO
1822,1958,Invitada reclama porque no reconoce 7 jugadas de 22.50 cada una desde las 15:17:08 hasta las 15:17:25 // pide la devolución a su cuenta ya que esta totalmente molesta // y solicita una revisón  de sus apuesta anteriores no son mayores a 5 soles siento la más minima 0.75. Juega desde su celular movistar huawei conectada a la red wifi. Invitada deja en claro que no es la primera vez que le sucede ya en una ocación se quedaron con su dinero e indica que  prefieren darle más importancia y valor a los dueños de las maquinas que a sus propios clientes fieles de años.,SOPORTE,CERRADO
1823,1959,RECLAMO SOBRE LA PROMOCION DE TO 50 PERO NO APARECE EN LAS OPCIONES DE SUB TIPO. CLIENTE SOLICITA QUE REVISEN SU CUENTA POR QUE NO SUBE DE POSICION EN EL AVANCE DEL TOP 50 A PESAR DE JUGAR TIROS DE 25 //40 //50 Y 100. Y LOS DIAS MULTIPLICADORES X4 Y X5. INDICA QUE ESTO LE SUCEDE EN VARIAS OPORTUNIDADES.  SE ADJUNTA FOTOS QUE ENVIA LA CLIENTE.,OPERACIONES TI,CERRADO
1824,1960,Invitada ingesa 50 dólares como recarga y se visualiza que cuenta es en soles. se adjunta foto de cuenta en dólares para la devolución.   ,FINANZAS - SOPORTE,CERRADO
1825,1961,Invitada le llego tarjeta con bono // donde le indica que se debe colocar al momento del registro // invitada no lo colocó al momento de registrarse y quiso hacerlo después. Al momento de ponerlo en la opción saldos le sale mensaje de error "código no valido".,CONTROL Y GESTION - DEPORTES - SOPORTE,CERRADO
1826,1962,Invitado desea cerrar cuenta // envía correo indicando ello y desistiendo de sus saldo de s/. 0.74.,SOPORTE,CERRADO
1827,1963,Invitada indica que estaba en el juego del trébol (Rainbow Luck) y cuando cae en el centro se llena el Will le abrió la jugada pero el ultimo giro gratis salió el trébol y no pago lo que correspondía al ultimo giro. Invitada desea que se haga la revisión y se cargue el pago que corresponda de la jugada. Se solicita imagen a la invitada de la jugada que reclama pero indica que no tiene.,CONTROL Y GESTION - SOPORTE,CERRADO
1828,1964,Clienta menciona que estaba en la atraccion ganando como 2500 soles y de la nada se paralizo el juego // cerro sesion y cuando volvio a ingresar no se regreso en la jugada que se habia quedado. Se adjunta malestar de la clienta a traves de whatsApp. Modelo y marca:Iphone XS Conexion: wifi Navegador: Safari,SOPORTE,CERRADO
1830,1966,Invitado quería realizar cashout de la apuesta ID 7597981 // sin embargo // menciona que no le salía el evento cuando entraba al historial // asegurando que le habíamos cancelado su apuesta. Cuando lo llamé le dije que la apuesta estaba aún abierta // me dijo que ahora si le figuraba la apuesta en el historial // causando gran malestar en el. Quiere que se revise su caso ya que al no poder ver su historial de apuesta // no pudo hacer cash out.,CONTROL Y GESTION - SOPORTE,CERRADO
