cod,numero_caso,descripcion,area_resolutor,estado
3316,3452,Invitado solicita el cierre de cuenta // ya que indica que los juegos no le han agradado. Se adjunta correo e imágenes que adjuntó (DNI),SOPORTE,CERRADO
3317,3453,Invitada indica que realizo jugada de S/3 // y el juego le abrió la opcion de comprar una jugada por S/ 9.57 para completar su jugada. Acepta esa compra presionando el boton de play (dorado) // pero el juego ya no le deja seguir con la jugada que supuestamente estaría comprando. Le salio el mensaje de : "Invalid seq for new gameround: 1". No pudo seguir con el juego y tuvo que actualizar la pagina // y  ya no regreso a su ultima jugada.  Invitada solicita revision // ya que perdio la oportunidad de obtener una mayor ganancia en la jugada.  Adjunta imagen del juego.,CONTROL Y GESTION - SOPORTE,CERRADO
3318,3454,Invitada indica que hizo la compra de tiradas libre de 1000 soles  // se interrumpio su sesion y cuando volvio entrar no estaba lo que habia ganado ella indica que era 1895 o 1985  // le salio el premio mayor.  juego: 14340000048180 ,CONTROL Y GESTION,CERRADO
3319,3455,Evento Olimpia vs. Universidad Cesar Vallejo inicia el 16/02/2022 19:30:00 // ya finalizó según Google // pero aún figura como abierto en Altenar. Invitado solicita que evento sea cerrado. ,CONTROL Y GESTION - SOPORTE,CERRADO
3320,3456,Invitado desea cambiar la cuenta BCP a una cuenta BBVA,SOPORTE,CERRADO
3321,3457,Juego no aparece en la relación: Speed vip blackjack G de Evolution. Invitado abre chat reportando que sus apuestas son rechazadas // envía imagen vía correo. Solicita la revisión de la mesa.,CONTROL Y GESTION - SOPORTE,CERRADO
3322,3458,invitado solicita cierre de ticket 1079693989 // aun queda pendiente el encuentro Randers Cimbria vs. Horsens IC,CONTROL Y GESTION - SOPORTE,CERRADO
3323,3459,invitada realizo retiro despues de haber canjeado su SE.,SOPORTE - PROMOCIONES,CERRADO
3324,3460,invitada realizo retiro despues de haber canjeado su SE.,SOPORTE - PROMOCIONES,CERRADO
3326,3462,Invitado solicita reactivación de su cuenta de casino online.  Se adjunta correo.,SOPORTE,CERRADO
3327,3463,NUEVA MODALIDAD SORTEO ELECTRONICO INVITADO INDICA QUE NO LE SALIO EL POP UP DEL PREMIO // SIN EMBARGO SALE CANCELADO EL PREMIO DE 500 SOLES // SE ADJUNTA FOTO DEL CRM.,PROMOCIONES,CERRADO
3328,3464,Invitada menciona que jugando a las 02:12 del dia d ehoy 18/02 cuando juego estaba en bonus ya teniendo una ganancia de 800 // juego la mando al lobby y cuando retomo el juego no le brindo el premio.  Indicando lo siguiente: "Hola // hace unos minutos estaba jugando en el juego megaways entre las 2.20 y las 2.30 y estaba en una atracción con un premio ganado ya de casi S/. 800.00 y se canceló el juego y me mandó al lobby y luego regresé y esos casi 800 no se cargaron a mi saldo. Revisé el historial y tampoco aparece el espacio de la atracción y el premio. Gracias.   LA ATRACCIÓN SUCEDIÓ EN ESTE MOVIMIENTO.  18/02/2022 02:12:21 Megaways Jack 14430000044489 Apuesta Efectivo S/-3.20 S/1 //596.25 18/02/2022 02:31:56 Megaways Jack 14430000044490 Apuesta Efectivo S/-2.40 S/1 //593.85,CONTROL Y GESTION - SOPORTE,CERRADO
3330,3466,Invitado menciona que a las 15 //12 jugando a 3d roulette hizo una apuesta de 1000 le rechazo la apuesta y lo dejo con un saldo de 25 soles,CONTROL Y GESTION - SOPORTE,CERRADO
3331,3467,Invitado solicita que eliminemos su cuenta Interbank // sólo dejemos la cuenta Scotiabank ya registrada hoy. Se adjunta correo.,FINANZAS - SOPORTE,CERRADO
3332,3468,Invitada exige se le ingrese reclamo por la eliminación de su bono por aprobación de retiro. Alega que no estaba informada de dicho proceso y quiere que bono sea devuelto. Indica además // que su ejecutiva le ofreció canjear el bono (pop up) sin comentarle que esto podría ocurrir por lo que considera una estafa dicho proceso. Se ingresa caso a exigencia de invitada. Se adjunta imagen de alira. ,CONTROL Y GESTION - SOPORTE,CERRADO
3333,3469,invitado envía correo para cierre de cuenta  // dice que ya no quiere seguir jugando. se adjunta imagen del .,SOPORTE,CERRADO
3334,3470,El día martes 15 se le brinda código de recuperación BPrevRecu200PENF3###4f2b52 a invitado y el día jueves 17 el Sr. Hector indica que no pudo cobrar su código. Ya no sale como activo // por lo que se solicita verificar si bono fue cobrado y si no // la reactivación del mismo.,SOPORTE - PROMOCIONES,CERRADO
3335,3471,Invitada realiza recarga de S/ 100 a traves de Kashio desde su app Interbank a las 11:12 pm. Indica que no le ha llegado aun su recarga.  Envia contancia al correo y se verifica que en lugar de ingresar el codigo generado por Kashio // ingresó  el numero de su DNI. Se verifica en Alira que aun figura en curso pero por el monto de S/ 200.  Menciona que en el app del banco no le pidio el codigo // solo le pedia su DNI // por eso ella ingreso lo que le solicitaba la aplicacion.  Se adjunta constancia de la invitada // e imagen de Alira y codigo de Kashio.,FINANZAS - SOPORTE,CERRADO
3336,3472,INVITADO INIDCA  NO HABER CANCELADO EL BONO DEL SORTEO ELECTRONICO // SU APOYO PARA LA DEVOLUCION,PROMOCIONES,CERRADO
3337,3473,Invitado indica que aposto S/. 2.50 y la jugada no se concreto ya que le salio el mensaje "Problema Tecnico". Actualizo y ya no continuo su jugada. Se verifica en alira la apuesta // mas no se visualiza ganancia // se le indico esto a invitado e insiste en que quiere devuelta su jugada ya que no pudo ver como finalizó  No cuenta con imagen del error // se adjunta jugada en mencion en Alira.,SOPORTE,CERRADO
3338,3474,invitada envia correo para reapertura cuenta ,SOPORTE,CERRADO
3339,3475,invitada reclama que desde el sabado que esta jugando no se estan acumulando los puntos ,OPERACIONES TI - SOPORTE,CERRADO
3340,3476,Invitada reporta que se encontraba jugando Frog Story y la máquina no pagaba nada solo se "comía" sus apuestas // cuando llegó un momento en el que la máquina comenzó a pagar le apareció un mensaje de desconexión del juego por lo que salió y al ingresar nuevamente apareció el mensaje "PENDING FUNDS TRANSFER. TRY AGAIN LATER...". Se ingresa caso a solicitud de invitada // ya que desea que se revise su caso y desea que le devuelvan todo lo que la máquina se "tragó". Indica que este juego no se encuentra activo ya que se desconectaba constantemente.,CONTROL Y GESTION - SOPORTE,CERRADO
3341,3477,Inivtado menciona que en la jugada de hoy 21 a las 11:31:10 juego se congelo en  jugada que era ganadora.,SOPORTE,CERRADO
3342,3478,invitado solicita cierre de cuenta  // se adjunta imagen de correo,SOPORTE,CERRADO
3343,3479,Invitada indica que esta en juegos gratis ganando mas de 3000 soles //en el ultimo giro le sale error // salio de la pagina y volvio a entrar y su premio desaparecio.  juego : 38270000056912,CONTROL Y GESTION,CERRADO
3345,3481,invitado en el primer set del juego de tennis  indica que el no colocó cerrar apuesta // pero al salirle presionó cancelar para que no se realice el cashout ya que no lo deseaba // sin embargo el sistema igual lo consideró // y no le permitió ganar  // reclama la ganancia que debió tener.,SOPORTE,CERRADO
3347,3483,Indica que esta jugando en BLACK JACK 3D (IRON DOG - SLOTS) y que tiene todas las de ganar y el juego se queda congelado y le aparece un mensaje indicando "que intente después"  Indica que no ver sus jugadas por que la imagen se a quedado congelada. Comparte imagen de lo que aparece y reclama se le devuelva los 10 soles (5 soles de apuesta + 5 soles de ganancia que según el invitado indica le aparece // se adjunta imagen. ,SOPORTE,CERRADO
3348,3484,Invitada solicita el cierre definitivo de su cuenta // declara ser ludópata por lo que también exige se le devuelva los depósitos que ha realizado desde que se reactivó su cuenta. Se adjunta foto de correo. ,SOPORTE,CERRADO
3349,3485,Invitada consulta por su recarga realizada el día 12/02 que a la fecha no lo visualiza. Solicita una respuesta lo más pronto posible. Se adjunta constancia de pago. ,FINANZAS - SOPORTE,CERRADO
3350,3486,Invitado informa que estaba realizando una apuesta deportiva de s/100 al evento Villarreal vs. Juventus cuando le apareció un mensaje de error // ingresó nuevamente para realizar la apuesta la cual se realizó con éxito. Sin embargo // minutos después se percata que la apuesta que le apareció como error si llegó a registrarse. Las apuestas tienen una diferencia de 20 seg. Invitado solicita la devolución de una de las apuestas. ID 1083858836 y ID 1083858589,SOPORTE,CERRADO
3351,3487,Solicita el cierre de su cuenta y que sus datos sea eliminado de todo // no desea que le brinden información de promociones. Se adjunta imagen de correo y perfil de Alira.,SOPORTE,CERRADO
3352,3488,INVITADO INDICA NO HABER REALIZADO LA APUESTA DE 2 //000 SOLES JUSTO ANTES DE COBRAR LO QUE TENIA DE SALDO ANTES QUE CIERRE APUESTAS DEPORTIVAS // SOLICITA LA DEVOLUCION DE LA APUESTA. CIRO MENDOZA,CONTROL Y GESTION,CERRADO
3353,3489,Invitado envía correo solicitando el cierre de su cuenta // indicando que no esta de acuerdo con los juegos y que los montos bajan muy rápido. Se adjunta imagen. ,SOPORTE,CERRADO
3354,3490,Invitada informa que el día de ayer le indicaron que tenía un premio por cobrar de la promoción Sorteo Electrónico. Al ingresar a su cuenta no le aparecía el Pop up // intentó nuevamente sin éxito. Se verifica en CRM que no hay glosa de la promoción. Se ingresa caso a insistencia de invitada y según su versión. ,SOPORTE - PROMOCIONES,CERRADO
3355,3491,Invitado envia correo solicitando anular cuenta BBVA 001108140212975406 y adjuntar cuenta BBVA No. 0011-0814-0223489805,FINANZAS - SOPORTE,CERRADO
3356,3492,Invitada realizó recarga por Safetypay desde su app del BBVA y monto aún no se refleja en su cuenta de casino.   Se adjunta evidencias. ,SOPORTE,CERRADO
3357,3493,Genera código via Safety por BBVA el 23/02/2022 18:34:18 por $400 // sin embargo hasta el momento no figura en su cuenta de casino // el monto ya fue descontado de banco. Se adjunta constancia de pago e imagen de Alira.,SOPORTE,CERRADO
3358,3494,SE INGRESA RECLAMO A INSISTENCIA DE INVITADA. Invitada no reconoce las 2 antepenultimas apuesta // en historial figura a las 23:08:45 hrs realiza una apuesta por S/200 y a las 23:08:48 hrs otra por S/200. Ella indica que se fue al baño y cuando regresó sólo tenía S/13 //94. Se visualiza que S/200 es la apuesta máxima del juego // por lo que pudo apretarlo casualmente. Se brinda instructivo para que pueda revisar su historial de juego // pero indica que no está estos movimientos. Se adjunta imagen de Alira.,SOPORTE,CERRADO
3359,3495,Invitada solicita el cierre de su cuenta. Motivo // máquinas no pagan.  Se adjunta imagen,SOPORTE,CERRADO
3362,3498,Desea que eliminen la cuenta anexada el 31/08/2021 12:16:02 // sólo se quedará con la cuenta BBVA anexada el día de hoy  24/02/2022 19:44:30.,FINANZAS - SOPORTE,CERRADO
3365,3501,Invitado no puede realizar RETIRO  // teniendo saldo disponible y documentos validados.  •Le figura un mensaje de : comunicarse con Soporte .,SOPORTE,CERRADO
3366,3502,Invitada indica que compro una atraccion de 13 juegos gratis // se colgo el juego y cuando ella renicio la atraccion desaparecio // solo le aparecio el juego de 240 // indica que lo compro por 260.  juego: 14430000052257,CONTROL Y GESTION - SOPORTE,CERRADO
3367,3503,Invitado desea el cierre de su cuenta online // no brinda motivo.  Confirma vía llamada  // desistir de su saldo de s/0.75.   Se adjunta correo. ,SOPORTE,CERRADO
3368,3504,Invitado indica que la apuesta de $620 a las 21:36:22 pm le pagó $520. Pero en ese momento la página lo saco del juego // y cuando volvio a ingresar // la ganancia no se habia acreditado a su saldo. Menciona que no es la primera vez que sucede que el juego se cierra.   Se visualiza en Alira que tuvo una anterior apuesta por el mismo monto y misma ganancia que si fue acreditada // se le menciona ello e indica que es de la siguiente apuesta // ya que en la imagen que envia de su jugada se visualiza la hora del juego resuelto a las 21:40:24.(la cual no figura en Alira).  Se adjunta prueba del invitado e imagen de Alira.,CONTROL Y GESTION - SOPORTE,CERRADO
3369,3505,Invitada indica haber dejado saldo de S/880 // cuando regresó a jugar // saldo bajó a S/80. Se verifica una apuesta de S/800 // sin embargo invitada indica no reconocer dicha apuesta ya que nunca ha realizado apuestas tan altas. Solicita la devolución de su efectivo de S/800 Se adjunta foto de alira. ,SOPORTE,CERRADO
3370,3506,invitado realizo recarga de 100 soles mediante niubiz y aun no se le hace efectivo,FINANZAS - SOPORTE,CERRADO
3371,3507,invitada indica que realizo recarga por la pasarela niubiz y no le llega  // quiere saber que paso con el dinero se adjunta constancia de deposito e imagen de alira de los depósitos que no le llegan .,SOPORTE,CERRADO
3372,3508,invitada realiza depósitos a través de niubiz  // no puede verlos indica que quiere saber que paso con esos depósitos  // sube constancia enviada por la invitada e imagen de alira ,FINANZAS - SOPORTE,CERRADO
3373,3509,Invita tiene un premio pendiente de sorteo electrónico pop up de s/.250 pero no puede visualizar el mensaje de recibir premio cuando inicia sesión. Ha intentado varias veces  // no le figura mensaje de aceptar cookies. Se recomendó probar de otro dispositivo pero indica que sólo tiene celular no tiene otros dispositivos y vive solo. Desea que lo ayuden.,SOPORTE,CERRADO
3374,3510,Invitada solicita la reapertura de su cuenta. Envía correo adjuntando DNI. Se verifica que envía la solicitud desde su correo registrado.,SOPORTE,CERRADO
3375,3511,Invitada solicita el Cierre d su cuenta Online - se le complica jugar por internet  // ya que es una persona de edad   y no usa mucho la tecnología .  •Adicional a eso  // le resulta tedioso COBRAR sus premios en la zona de apuestas deportivas  // ya que implica subir escaleras y permanecer esperando la aprobación //  ya que usualmente los premios de GANA CASH SON $10 y el momto min requerido es de $25.,SOPORTE,CERRADO
3376,3512,invitado indica que no se le realizo el deposito del gana cash del dia 22/02  // envía correo con imagen donde le dice que según su avance  // tenia un premio de 10 dólares  // se verifica en alira que no hubo deposito del premio el 22.,OPERACIONES TI - SOPORTE - PROMOCIONES,CERRADO
3377,3513,Invitado realiza recarga de S/ 480 vía Kashio a las 22:27 y aun no se procesa. Codigo de pago 220581941804  Se adjunta constancia de pago e imagen de Alira.,SOPORTE,CERRADO
3378,3514,Solicita cierre de su cuenta. Invitado Nivel 1.  Se adjunta correo.,SOPORTE,CERRADO
3379,3515,Invitada realiza una tranferencia por interbank  // y no se carga a su cuenta del casino online tampoco se visualiza el movimiento en alira.,SOPORTE,CERRADO
3380,3516,Invitado envia correo para cerrar cuenta ,SOPORTE,CERRADO
3381,3517,Invitado realizo recarga por niubis mediante niubis el dia sabado(26) a las 11:26 // se le debito el saldo de su cuenta pero no se le hizo efectivo.,FINANZAS - SOPORTE,CERRADO
3382,3518,Invitada solicita reactivación de su cuenta. Se adjunta correo.,SOPORTE,CERRADO
3388,3524,Invitado indica que su ejecutiva le indicó que ganó premio de 100 bonos // ingresó a la página tal cual le indicaron // pero el mensaje de pop up no figura // borro cookie // historial de navegador y nada. En CRM aún figura que premio está pendiente de cobro // en Alira no tiene código canjeado por dicho monto. Su apoyo por favor // invitado sólo desea cobrar su bono de SE.,SOPORTE - PROMOCIONES,CERRADO
3389,3525,invitada indica que el codigo brindado no se puede canjear  codigo : BE400PENX1F1###190a2b,SOPORTE,CERRADO
3390,3526,Invitado tiene Bono POPUP por 150soles  // no le sale las ventanas de aviso  // ingresa de otro equipo pero no le muestra. Adjunto imagen. Invitada solicita su premio.,SOPORTE,CERRADO
3391,3527,Indica que estuvo realizando jugadas en LUCKY PUG el cual le dio bonus pero esto no se hizo efectivo. Se pregunta a al invitada si actualizo su dispositivo para que puedan cargar las jugadas // indica que no. Se pregunta si tiene algún monto en efectivo o de jugadas o bonus por reclamar // indica que no y no tiene imagen. ,CONTROL Y GESTION - SOPORTE,CERRADO
3392,3528,La invitada no se percató de que tenía bono activo al momento de solicitar un retiro. Se adjunta imagen de alira.,PROMOCIONES,CERRADO
3393,3529,JUEGO: GTB Dolphins Pearl Deluxe mobile incidente:  1/03/2022  01:24:51 con juego 111963774 Invitada realiza una apuesta de S/0.30 e indica que juego abrió atracción // pero se colgó // reinició sesión desde el mismo dispositivo // pero las atracciones no volvieron (se visualiza que gana premio de S/6 a las 01:31:27hrs a lo que invitada indica que corresponde a otro movimiento). Invitada solicita jugar la atracción. Se adjunta imagen.,SOPORTE,CERRADO
3394,3530,invitado desea cierre de cuenta,SOPORTE,CERRADO
3395,3531,Juego: GTB Top O The Money Mobile Incidente 28/02/2022 06:29:50 PM con juego 111841136 (Según la hora es la que mas se acerca) Invitado indica que realizo una apuesta de 4 soles y 2 veces se ha quedado colgado el juego justo cuando tenía jugadas de bonus. Menciona que fueron 2 veces en una le dio 5 vueltas y la segunda 10 vueltas x 4.00 ..indica que le debía pagar entre S/.400.00 a 800.00. Pide por favor que revisen sus jugadas.,CONTROL Y GESTION - SOPORTE,CERRADO
3397,3533,Tablet / wifi / safari Invitado indica que estuvo jugando y se congeló sin pagarle // volvió a entrar // generó otra apuesta pensando que recuperaría el premio anterior pero no fue así // indica que no sabe el monto del premio ya que el juego consiste en que los bloques van bajando con la posibilidad de incrementar el premio. Se adjunta imagen de la hora en que ocurrió ,CONTROL Y GESTION - SOPORTE,CERRADO
3398,3534,Invitado reclama que su apuesta ID: 1088974101 - 01/03/2022 • 17:40 se visualiza como anulada. Indica haber ganado por lo que exige se paga monto de ganancia.  En altenar se visualiza dicha apuesta como "Vacio." Se adjunta imágenes // se ingresa caso para su revisión. ,SOPORTE,CERRADO
3399,3535,Invitada informa que no ha recibido el abono de su retiro de s/1000.00 solicitado el día 25/02/22 a las 05:55:57 PM. Se verifica en Alira que fue enviado a su cuenta el día 25/02 a las 07:40:36 PM. Indica que no lo visualiza en su cuenta // solo recibió el retiro de s/2500.00 solicitado el día siguiente. Adicional a ello // indica que se ha contactado con su banco e ingresó un reclamo con ellos // y le informaron que no visualizan ese monto en su cuenta. Solicita una respuesta a la brevedad sobre su caso y revisar si efectivamente el abono fue enviado. Manifiesta su molestia e indica que posiblemente el monto se extornó a nuestra cuenta.   Solicita respuesta vía Whatsapp ya que no cuenta con correo electrónico.,FINANZAS - SOPORTE,CERRADO
3400,3536,Invitado informa que no tenía conocimiento que había un monto mínimo de recarga // se indica que en nuestros medios de pago se informa que el monto mínimo es de s/100.00. Se invita a recargar la diferencia para que pueda visualizar el saldo en su cuenta pero indica que no puede por lo que // solicita la devolución de los s/10.00 que recargó vía transferencia bancaria Interbank.  Se brinda plazo estimado de atención. ,SOPORTE,CERRADO
3401,3537,Invitada menciona que tiene 2 retiros que no le ha llegado a su cuenta uno de 1000 soles el dia 10/01 y otro de 600 25/01 ,SOPORTE,CERRADO
3402,3538,INVITADA SE ENCONTRABA EN ATRACCIÓN Y DE LA NADA SE CONGELÓ. INDICA QUE SALIÓ AL LOBBY // REGRESÓ AL JUEGO Y LA ATRACCIÓN DESAPARECIÓ.  SE ADJUNTA IMAGEN.  JUEGO: 14430000060538 PROVEEDOR: 60538-76271133630 SERVICIO: Microgaming Mobile - Slots OPERACIÓN: 486441531  ,CONTROL Y GESTION,CERRADO
3403,3539,A LA INVITADA SE LE CANCELO EL POPUP YA QUE REALIZO UN RETIRO PREVIO Y NO LE FIGURO LA VENTANA EMERGENTE .,SOPORTE - PROMOCIONES,CERRADO
3404,3540,Invitada indica que a intentado ingresar este código BP400PENF1###35e7c0 brindado por su ejecutivo el día de 2/3 a las 3:42pm // sin embargo le figura código inválido // se pidió realizar descartes revisando si hay un espacio vacio // pero indica que le sigue saliendo el mismo error. No quiso adjuntar imagen // se adjunta imagen de CRM,SOPORTE - PROMOCIONES,CERRADO
3405,3541,Invitado indica que entre el rango de horas de 11:10 am y 11:18 am tuvo un saldo de S/. 1250 aproximadamente // y que de la nada bajo a S/. 300 aprox. No brinda mayor información // ni imagenes de prueba. Se ingresa reclamo a insistencia del invitado. Solicita revision de sus jugadas ya que menciona que hay un error en sus saldos.,CONTROL Y GESTION - SOPORTE,CERRADO
3406,3542,Se brinda speech de baneo temporal a invitada. Se solicita los documentos de Movimientos y constancias de pago. Se brinda plazo de tiempo una vez se envien. Se brinda ayuda para poder enviar los documentos // y se estuvo en espera a pedido de la invitada // para poder recepcionar sus documentos y poder ayudarla a derivarlos. Invitada no acepta plazo de 12 días y quiere realizar una denuncia al casino por fraude.  Invitada solicita el chat que mantuvo // como prueba para su denuncia.,SOPORTE,CERRADO
3407,3543,Invitada tiene promo POPUP // PERO NO LE SALE LA VENTANITA AL INCIAR SESIÓN Su celular es Samsung // esta ingresando desde Google  Chrome y tu operador es movistar,SOPORTE - PROMOCIONES,CERRADO
3408,3544,Invitada indica que no le aparece el POP UP del sorteo electrónico.  Se observa que su bono todavía esta en PENDIENTE y se indica que reinicie su dispositivo y que vuelva a ingresar o pruebe por otro dispositivo. Invitada indica que ya realizo estas pruebas y no aparece. Se adjunta imagen compartida y de ALIRA.,SOPORTE - PROMOCIONES,CERRADO
3409,3545,Invitada indica ganó premio de Sorteo Electrónico de 100 soles. Ingresó a la página tal cual se le indicó // pero el mensaje de pop up no figura // borro cookie // historial de navegador y nada. Ingresó a otros dispositivos y tampoco le sale el pop-up. En CRM aún figura que premio está pendiente de cobro // en Alira no tiene código canjeado por dicho monto. ,SOPORTE,CERRADO
3410,3546,Se avisa a invitado que tiene Bono POP UP  // sin embargo me indica que no le mostró nada en su celular prueba de otro equipo pero tampoco le figura . Al volver a revisar en el CRM  // figura como "Cancelado". Invitado indica que no le apareció ningún cuadro de aviso al entrar . El premio es por 100 soles.,SOPORTE - PROMOCIONES,CERRADO
3411,3547,Invitada solicita la reactivación de su cuenta. Se adjunta foto de correo.  ,SOPORTE,CERRADO
3412,3548,Invitada envia correo para reapertura de cuenta,SOPORTE,CERRADO
3413,3549,Invitado solicita reactivar su cuenta online.  Se adjunta imagen de correo. ,SOPORTE,CERRADO
3414,3550,Invitada indica que realizo recarga por Kashio de S/ 300 y aun no figura en su saldo. Se verifica en Alira que aun figura en curso. Código de pago: 220632657332  Adjunta constancia de pago,FINANZAS - SOPORTE,CERRADO
3415,3551,Invitado solicita cambio de cuenta bancaria de BCP a Interbank,FINANZAS - SOPORTE,CERRADO
3416,3552,Invitada solicita la reactivación de su cuenta online.   Se adjunta correo. ,SOPORTE,CERRADO
3417,3553,Invitado solicita cambiar de nombre de usuario a : S.L.F.7 Se valida datos de su registro // se confirma identidad. Se adjunta foto de chat con solicitud de invitado. ,SOPORTE,CERRADO
3418,3554,Invitado molesto reporta una demora en su recarga hecha por Kashio desde su app BCP // se visualiza aún en curso. Cod de pago: 220642714485 Se adjunte imégenes. ,FINANZAS - SOPORTE,CERRADO
3419,3555,Invitado solicita por correo que revisen su HISTORIAL de jugadas y su USUARIO ya que siempre pierde y tampoco sale ganador en ningún sorteo // asimismo indica que le parece raro y piensa que hay una estafa por parte del casino.,CONTROL Y GESTION - SOPORTE,CERRADO
3420,3556,Invitada indica que a las 15:01 pm con apuesta de S/ 1 le brinda 15 juegos gratis y le sale mensaje  de error y la saca del juego. Vuelve a ingresar a seguir jugando y a las 15:05:37 con apuesta de S/1 le brinda 30 juegos gratis y el juego la saca nuevamente.   Solita la revision de sus juego ya que desea saber si las jugadas gratis concluyeron correctamente.,CONTROL Y GESTION - SOPORTE,CERRADO
3421,3557,Invitada reporta demora en su recarga realizada por Kashio desde BBVA.  Se visualiza en alira "en curso" Se adjunta imágenes. ,FINANZAS - SOPORTE,CERRADO
3422,3558,invitada indica que no le llega su deposito,FINANZAS - SOPORTE,CERRADO
3423,3559,INVITADA REALIZÓ RECARGA POR KASHIO A TRAVÉS DEL BANCO BCP PERO HASTA AHORA NO SE CONCRETA LA RECARGA Y YA LE DESCONTARON. SE ADJUNTA CONSTANCIA.,FINANZAS - SOPORTE,CERRADO
3424,3560,Invitado informa que se encontraba jugando Poker Holdem // el salió un póker para el jugador y no le pagaron // indica: "me salía como si me hubiera retirado del juego cuando yo había apostado // la apuesta fue de 100+200 y la ganancia era de 1200". Indica que no es la primera vez que le pasa eso porque no es la primera vez que el sistema no le recibe la apuesta. "Salía un mensaje que no había colocado mi apuesta a tiempo cuando era mentira porque ya había apretado el botón de apostar varias veces" "tenía en mesa 3 aces y después salió el cuarto //  en lugar de pagarme 1200 soles me quitaron 100 soles . Lo mismo me pasó en una jugada anterior. Ya cansa."  Solicita que por favor revisen su caso. ,CONTROL Y GESTION - SOPORTE,CERRADO
3425,3561,juego falla constantemente Sí el problema es constante genera un reclamo para que se revise a mayor detalle,OPERACIONES TI,CERRADO
