cod,numero_caso,descripcion,area_resolutor,estado
2532,2668,invitada indica que le apareció en su saldo el monto de 1279 soles pero que de repente ese saldo desapareció sin haberlo cobrado. Comparte imagen de su saldo en cuenta del casino // se adjunta imagen ,SOPORTE,CERRADO
2533,2669,Invitada comunica que estuvo jugando en LORD OF THE OCEAN y que le abrió las jugadas gratis y que tenia como 55 soles de premio acumulado pero la conexión se perdió y cuando volvió a ingresar ya estaba en el segundo tiro de su efectivo. Y que sacando su cuenta entre lo que tenia de efectivo y los 55 que iba ganando deberían sumar 100 soles // no tiene imagen.,CONTROL Y GESTION - SOPORTE,CERRADO
2534,2670,Invitada realizó depósito vía Pagaefectivo y hasta le momento no llega a su cuenta de casino Online.  Se verifica en Alira y monto sigue "En curso".  Código de pago (CIP) 82462325.  Se adjunta voucher de invitada e imagen de Alira.  ,FINANZAS - SOPORTE,CERRADO
2535,2671,Invitado envía correo solicitando el cierre de su cuenta de la plataforma. Se adjunta imagen del correo ,SOPORTE,CERRADO
2536,2672,Invitado solicita la devolución de su bono (BD3) ya que se eliminó al aprobarse su retiro.  Invitado un poco grosero amenaza con ir a indecopi pese a haberle explicado los TyC. ,SOPORTE,CERRADO
2537,2673,Invitada solicitar reaperturar su cuenta. ,SOPORTE,CERRADO
2538,2674,INVITADA SE ACERCA AL CASINO A INDICAR QUE DESEA RETIRAR LO DEPOSITADO // SE LE EXPLICO QUE SI REALIZA UN DEPOSITO TIENE QUE ESPERAR A DARLE UNA VUELTA AL MONTO PARA RECIEN RETIRAR // INDICA QUE NADIE LE INDICO ESO // SE VERIFICA QUE NO ES SU 1ER DEPOSITO // INVITADA MOLESTA DICE QUE PREFIERE JUGAR FISICO QUE ONLINE Y QUE DESEA QUE POR ESTA VEZ LE DEVOLVAMOS EL DINERO PARA JUGARLO EN EL CASINO FISICO // SE VERIFICA EN ALIRA QUE REALIZO UN DEPOSITO DE S/500 // Y DEJO UN SALDO DE S/488,CONTROL Y GESTION - SOPORTE,CERRADO
2539,2675,Invitada indica que el juego no da ganancias hace mas de una semana  // lleva gastandose mas de 50 000 soles  // y cada vez que dobla le sale el as .,CONTROL Y GESTION,CERRADO
2540,2676,Invitada presenta problemas al momento de pagar la atracción. culminó atracción y tuvo que abonarse el monto de 75.20 sin embargo salió mensaje de "error tecnico" y al volver a ingresar no se cargó el pago. Pide se revise el juego ya que no es la primera vez que le ocurre (invitada tiene 2 reclamos anteriores por el mismo caso // en el mismo juego)  indica que inconveniente fue en apuesta realizada apróximadamente entre las 9:20am a 9:25am de hoy // en alira solo se visualiza jugadas de invitada hasta las 08:26:12 AM. Se adjunta fotos de alira donde se muestra últimas apuestas realizadas. ,CONTROL Y GESTION - SOPORTE,CERRADO
2541,2677,invitado indica que en el torneo quedo con 4000 puntos  // teniendo una ganancia de S/200. pero en crm se verifica lo contrario.,SOPORTE,CERRADO
2542,2678,Invitado informa que aún no se abono pago de apuesta realizada (1014756885) se indica que de haber gando abono se realizará al culmino del partido // invitado molesto indica que partido ya terminó.  Se adjunta evidencia donde se verifica que partido aún continúa y foto de altenar.  Se ingresa reclamo a insistencia de invitado. ,SOPORTE,CERRADO
2543,2679,Invitado envía correo mostrando la disconformidad de la respuesta a su reclamo 2677. Indica que // el día de ayer a las 11:59pm (hora en la que cierra el torneo) él se visualizaba con 4000 puntos // estando dentro de los 50 primeros puestos // esto lo visualizó hasta la 1:00am.  Hoy entre las 10am y 11am se visualiza en otra posición con premio de S/50.  no está de acuerdo ya que tonero cerró con puntaje señalado de 4000.  Invitado solicita que se pague premio que le corresponde por puntaje // en todo caso estariamos faltando a lo prometido. No adjunta evidencia Se adjunta foto de correo.  ,OPERACIONES TI - SOPORTE,CERRADO
2544,2680,Invitado realizo un retiro de su premio del top 50 y se le cancelo su bono de duplica tus 3 primeros depositos // va en el segundo deposito.,CONTROL Y GESTION,CERRADO
2545,2681,Invitada menciona que jugando a las 19:38 o 19:39 jugando fortune reels version movil // le salió problema técnico // justo en el momento que tenia una ganancia de 31.90 o 32.90 por una apueta de 0.40 centimos.,CONTROL Y GESTION - SOPORTE,CERRADO
2546,2682,Invitada presentó nuevamente problemas al momento que le pague la atracción // esta vez no visualizó el monto a pagar ya que salió "EROR TÉCINICO"  y al volver a ingresar no se cargó ningún  premio ya que seguía con su mismo saldo.   Pide revisen el juego ya que no es la primera vez que le ocurre (invitada tiene 4 reclamos anteriores por el mismo caso // en el mismo juego). Indica que inconveniente fue en apuesta realizada aproximadamente entre las 8:00AM de hoy // en Alira solo se visualiza jugadas de invitada y con corte de tiempo entre las 07:46:49 AM y 08:06:38 AM.   Se adjunta imagen de Alira con últimas apuestas realizadas e imágenes que adjunta invitada.,CONTROL Y GESTION - SOPORTE,CERRADO
2548,2684,Invitada solicita print de historial donde se visualice que se paga premio por el torneo del día miércoles.  Se ayuda a invitada verificarlo desde su historial // Invitada incómoda insiste con el print indicando que no puede filtrar fecha (entre otros)  Se detalla monto anterior antes del pago // monto siguien luego del pago // apuestas continuas. Invitada comprende pero insite que se le envíe una pantallazo de su historial.  Se ingresa solicitud a pedido de invitada.  Se adjunta imagen la cual confirma pago el día de ayer 14/10 a las 11:54am. Monto S/100,SOPORTE,CERRADO
2552,2688,invitada desea cerrar su cuenta y desiste de saldo actual,SOPORTE,CERRADO
2553,2689,Invitado hoy en la madriugada realizo varios depósitos  de los cuales 2 fueron por Niubiz // sin embargo el primero no se abonó a su cuenta // luego lo vuelve a hacer teniendo éxito // sin embargo en su estado de cuenta están los 2 movimientos. En la foto que se adjunta los que dicen sin procesar // el primero no se abono y el segundo si se abono // por lo tanto le descontaron 2 //000 soles sin embargo a su cuenta solo llegaron 1 //000 soles.,FINANZAS,CERRADO
2554,2690,Invitado realiza depósito vía Pagoefectivo y hasta el momento no se verifica en su cuenta de casino online // está "En curso".  Se adjunta imágenes de invitado y de Alira. ,SOPORTE,CERRADO
2556,2692,INVITADA SE ACERCA AL COUNTER A INDICAR QUE A TRAVES DE LA WEB TENIA 14 OPCIONES CANJEADAS Y QUE EN SU HISTORIAL SOLO LE APARECIAN 9 // SE REVISA HISTORIAL Y EFECTIVAMENTE SOLO TIENE 9 CANJES// ELLA ASEGURA QUE LE SALIAN LOS 14 CODIGOS Y DESPUES YA NO/ SE ACTUALIZA // SE INGRESA DESDE OTRO DISPOSITIVO Y LE SIGUEN APARECIENDO 9 OPCIONES// SE ADJUNTA FOTO DE SU CANJE VIA WEB.,OPERACIONES TI - SOPORTE,CERRADO
2557,2693,invitada desea cierre de cuenta y desiste de su saldo que tiene disponible,SOPORTE,CERRADO
2558,2694,invitado desea cerrar su cuenta por motivo de ludopatia,SOPORTE,CERRADO
2559,2695,Invitado desea el cierre de su cuenta  //por temas personales.  Se adjunta correo. ,SOPORTE,CERRADO
2560,2696,Invitado indica que cuenta adjunta BCP // no le pertence. Solicita sea eliminada y solo deje cuenta que adjuntó hoy 17/10 - 08:46:52 AM Se adjunta imagen (a eliminar) de cuenta bancaria que invitado no reconoce.,FINANZAS - SOPORTE,CERRADO
2561,2697,Invitada envía correo solicitando el cierre de su cuenta. Se adjunta imagen del correo.,SOPORTE,CERRADO
2562,2698,Invitada recargó S/50 vía recaudo // se informó por chat que debería realizar otra de S/50 o más para que se actualice el saldo en su cuenta de invitado. Reclama que hizo la transferencia de la diferencia pero a la hora de pedirle los comprobantes se dio cuenta que solo se había cargado una vez // solicita la devolución de su dinero (S/50).,FINANZAS - SOPORTE,CERRADO
2563,2699,Invitado envía correo para acierre de cuenta por ludopatía,SOPORTE,CERRADO
2564,2700,invitado solicita cierre de cuenta // envia correo.,SOPORTE,CERRADO
2565,2701,Invitado indica que realizo dos veces una compra de juegos gratis  // el cual el juego se paro y las jugadas no continuaron  // volvio a entrar al juego y solo se cobraron esas dos apuestas sin premio alguno // lo cual el cada vez que compra juegos siempre le da premios como la foto que se adjunta.  juego :  24780000047227 - 24780000047229 ,CONTROL Y GESTION,CERRADO
2566,2702,Invitado indica que realizo dos veces una compra de juegos gratis  // el cual el juego se paro y las jugadas no continuaron  // volvio a entrar al juego y solo se cobraron esas dos apuestas sin premio alguno // lo cual el cada vez que compra juegos siempre le da premios como la foto que se adjunta.  juego :  24780000047227 - 24780000047229 ,CONTROL Y GESTION,CERRADO
2567,2703,invitada realiz un retiro antes de ingresa su bono de sorteo electronico  // por ello se le anulo su sorteo . por favor para que puedan revisar su caso.  codigo:  BP600PENF10###2895ab,CONTROL Y GESTION,CERRADO
2568,2704,Invitada envía correo solicitando la reactivación de su cuenta. Se adjunta imagen del correo recibido.,SOPORTE,CERRADO
2569,2705,Invitada realizó un depósito usando su banca BBVA  // método: Pagoefectivo y hasta el momento el monto no se verifica en su cuenta de casino online  // ya se debitó monto //  el estado es "En curso".   Código CIP: 83261020   Se adjunta imagen de constancia de pago y de Alira. ,SOPORTE,CERRADO
2570,2706, Invitada enviar correo para no bloquear su cuenta,SOPORTE,CERRADO
2571,2707,Invitada envía correo solicitando se reactive su cuenta del casino online. Se adjunta imagen del correo recibido.,SOPORTE,CERRADO
2572,2708,Invitado indica que de su reclamo 2627 // faltaría el monto de 97.20 soles // que el monto total de lo que no le pago el juego es de 219.30 soles y no los 122.10 soles que se le brindo,CONTROL Y GESTION - SOPORTE,CERRADO
2573,2709,Invitado indica que estuvo jugando "Blackjack" y juego tuvo que abonarle premio de 800USD pero lo sacó del juego // y al volver a ingresar monto no cargó a su cuenta // indica fue 10min antes de que se contacte (se contacta por chat a las 10:50am)  A las 10:29:48 AM se verifica un pago de 800USD y se indica a invitado // el cual indica monto no cargó a su cuenta.  se adjunta foto de excel del premio encontrado por dicho monto hasta el momento que se contacta. Se ingresa reclamo a insitencia de invitado // quien indica no cargó premio.  ,CONTROL Y GESTION,CERRADO
2574,2710,invitada no reconoce sus dos apuesta // indica que su apuesta de S/640.00 al momento que la realizo fue cancelada y aun asi se le hizo el descuento  // cuando volví a empezar otro juego automáticamente se hizo otra apuesta con el monto de S/640.00.,CONTROL Y GESTION - SOPORTE,CERRADO
2576,2712,Invitada indica que realizo un retiro y cuando se hizo efectivo perdio su bono // por favor pide que revisemos su caso.  codigo promocional: BP700PENF8###35bf2d,CONTROL Y GESTION,CERRADO
2577,2713,Invitado se contacta por chat de la plataforma y comunica que ha sucedió un inconveniente con su juego por que no le han acreditado el monto de 2.265 soles generados en el juego GOLDNROCKS. Invitado comparte video e imagenes por WAAP.,CONTROL Y GESTION - SOPORTE,CERRADO
2578,2714,Invitada desea la reapertura de su cuenta de casino online.  Se adjunta imagen de correo.,SOPORTE,CERRADO
2579,2715,SE INTERRUMPE LA SECUENCIA DE LAS CARTAS. APUESTA 80 SOLES Y NO LE DEVUELVEN LA APUESTA HABIENDO SALIDO UN MENSAJE QUE LA RONDA FUE CANCELADA Y LA INCIDENCIA FUE RESUELTA. CONEXION POR DATOS DEL CELULAR,CONTROL Y GESTION - SOPORTE,CERRADO
2580,2716,Invitado indica que intentó realizar cash out a evento 1017166091 pero no se le permitió. Explica que dicho botón aparece el todos los eventos múltiples que ha realizado anteriormente y le brinda opción a retirarse con algo de efectivo devuelto. Solicita se reconozca procentaje de su apuesta múltiple realizada ya que según indica es una falla del sistema.  Se adjunta foto de altenar de apuesta múltiple. ,SOPORTE,CERRADO
2581,2717,Invitado comunica por chat que ha realizado una recarga pero no a pasado a su cuenta del casino // se verifica que su deposito por 250 soles realizado hoy 20/10 a las 18:08 horas por la pasarela de PAGO EFECTIVO figura como "EN CURSO". Se solicita imagen de constancia de deposito para poder realizar la verificación // se adjunta imagen compartida por correo. ,FINANZAS - SOPORTE,CERRADO
2582,2718,invitada tiene reclamo en el libro de reclamaciones solicitando cierre definitivo de cuenta y no reaperturarla bajo ningún motivo // se comunica e indica que han vulnerado su correo y que no es ella quien ha realizado el reclamo // solicita que se reapertura .,SOPORTE,CERRADO
2583,2719,Invitado envía correo solicitando la reactivación de su cuenta. Se adjunta imagen.,SOPORTE,CERRADO
2584,2720,INVITADA NO PUEDE INGRESAR AL JUEGO PORQUE SE HA REALIZADO UN MANTENIIENTO NO PROGRAMADO DE LOS JUEGOS MICROGAMING // ES EL UNICO QUE ELLA JUEGA Y HOY ES TORNEO Y HA PERDIDO LA OPORTUNIDAD DE APROVECHAR LOS PRIMEROS LUGARES SEGUN MANIFIESTA // ESTA PIDIENDO UN RESARCIMIENTO ECONOMICO POR LO SUCEDIDO // NO INIDCA MONTO // QUEDO EN EL PUESTO 6 CON 900 SOLES.,CONTROL Y GESTION,CERRADO
2585,2721,Invitada se comunica por el chat de la plataforma indicando que tenia en su saldo el monto de 309.83 soles y de pronto  ahora le aparece que tiene 109.83 soles y que debe ser un error de la plataforma. Se observa en el sistema que la invitada tenia 309.83 soles a las 18:14 horas pero a las 18:17 horas tiene una apuesta por 200 soles en el juego ROARING WILDS MOBILE quedándole como saldo el monto de 109.83 soles // se informa lo observado a la invitada pero indica que ella no ha realizado esa apuesta con ese valor. ,SOPORTE,CERRADO
2586,2722,Invitada Paola realiza un retiro de 2000 soles a las 05.33pm // ingresa el bono a las 05:47pm pensando que su retiro ya estaba aprobado // y cuando aprueban el retiro a las 06:24pm el bono de sorteo electronico desaparece. Se adjunta imagenes de alira. CODIGO: BP700PENF8###1bcc97,CONTROL Y GESTION,CERRADO
2587,2723,Invitado solicita la reactivación de su cuenta -Se adjunta foto de correo. ,SOPORTE,CERRADO
2588,2724,Invitado informa que no recibió un premio de s/1 //600.16. Indica que le apareció un mensaje de error y el pago no se realizó. Se adjunta imágenes.   Celular Chrome Datos móviles,CONTROL Y GESTION - SOPORTE,CERRADO
2589,2725,Invitada reporta por el chat que hizo una apuesta en el juego en mención de S/0.40 y de pronto su saldo se fue a 0. Se revisa en alira que hubo una apuesta de S/200 los cuales invitada no reconoce. Se adjunta imagen de alira,SOPORTE,CERRADO
2590,2726,Invitado indica que solicita la información de sus depositos del día 8 y 15 de octubre // se informa que el 8 no hay movimientos // se enviarán los del día 15.,SOPORTE,CERRADO
2591,2727,Invitado envía correo de su constancia de deposito realizado por la pasarela PAGO EFECTIVO por la SCOTIABANK pero se observa que en la constancia figura un con la hora de 04:46 am // siendo realizado en el sistema a las 04:16 am. Se adjunta imagen compartida por el invitado,FINANZAS - SOPORTE,CERRADO
2592,2728,Invitada insiste en ingresar reclamo a pesar que no ha jugado en nuestra plataforma online este mes // pero debido a su insistencia se ingresa como queja // ella quiere indicar que los meses pasados ha tenido problemas con la pagina del casino se para // se pone lento.,SOPORTE,CERRADO
2593,2729,Invitado desea reactivar su cuenta.  Se adjunta imagen de correo. ,SOPORTE,CERRADO
2594,2730,Invitado desea hacer un reclamo con respecto a una jugada de black jack // abre chat para solicitar se pueda comunicar con él un supervisor e indica que se le niega esa solicitud y no se le dan explicación del por qué // evadiando la pregunta. Se siente incómodo por no haber recibido una respuesta a su solicitud y siente que la atención brindada no ha sido eficiente. Entiende que hay un procedimiento a seguir // sin embargo // no le ha parecido bien la manera de comunicarse con él. Además indica que se le cierra el chat sin posibilidad de volver a hablar con el asesor.,SOPORTE,CERRADO
2595,2731,Invitado indica: A él le dan una carta que es el 10 // a la dealer se le cae una carta // el supervisor de mesa va // recoge la carta y no la cuenta si no que la manda a la baraja (como si hubiese sido la carta consumida) // anula la carta y la siguiente carta que le debió haber tocado es el 10 pero se la da a la persona del costado porque la carta que se le cayó al dealer la anuló y perjudica toda la jugada (a él le salía un 20 contra un 4). Era un pase ya ganado.,CONTROL Y GESTION - SOPORTE,CERRADO
2596,2732,Invitado realizó un parley de 2 partidos  // el cual  //ya teniendo un evento ganado  // quedaba pendiente evento SOLOLA VS DEPORTIVO GUASTATOYA   // con resultado de : EMPATE . // invitado indica que durante el partido Guastatoya  //mete 1 GOL  // es ahí donde  toma la decisión de cerrar CASHOUT con el monto de 32 soles . *Sin embargo  // transcurrieron unos segundos y dieron por anulado el GOL . ,SOPORTE,CERRADO
2598,2734,Invitada realizó el día de ayer una recarga por el monto de 50USD a su cuenta de casino registrada en Soles.  Se explica que recargas deberán ser de acuerdo al tipo de moneda registrada.  -Se adjunta cuenta en dólares para la devolución Cta. Siemple Dólares Interbank 2563209563727  -Se adjunta foto de comprobante de pago ,FINANZAS - SOPORTE,CERRADO
2599,2735,Invitada realizó recarga con tarjeta BBVA por un monto de S/100 vía pago efectivo // hasta el momento monto no se refleja en su cuenta de casino. -Se adjunta evidencias.  ,SOPORTE,CERRADO
2600,2736,invitado desea cierre de cuenta,SOPORTE,CERRADO
2601,2737,Invitado informa que aún no visualiza su recarga realizada de s/100.00. Se verifica en Alira que operación figura como "en curso". Invitado envía imágenes para su revisión. Se adjuntan.,FINANZAS - SOPORTE,CERRADO
2602,2738,Invitada indica que el dia viernes realizo dos retiros uno de 1000 y uno de 3000  // el de 1000 si le llego hoy 25/10 pero el de 3000 nunca llego a su cuenta BCP // por favor validar ya que en alira salen aprobados con fecha de envio.,FINANZAS,CERRADO
2603,2739,Invitado indica haber realizao un recarga el día 23 por SafetyPay // y monto aún no se ve reflejado // se verifica en alira dicha recarga en curso.  Se adjunta fotos compartidas por invitado.  Se adjunta foto de alira de supuesta recarga. ,FINANZAS - SOPORTE,CERRADO
2604,2740,Se recibe correo de invitado solicitando se ingrese reclamo. Invitado indica que en menos de 1h han salido 18 Black Jack. No está de acuerdo con lo sucedido indicando que al parecer "máquinas" están arregladas.   Se verifica que invitado el día de hoy solo ha jugado en < Multi Hand Atlantic City Blackjack Mobile >  Se adjunta foto de correo. ,SOPORTE,CERRADO
2605,2741,Invitado coloco su bono de sorteo electronico ayer pero tenia un retiro pendiente que al aprobarse el bono desaparecio // por favor si pueden revisar su caso.  codigo //BP2000PENF11###4bc006,CONTROL Y GESTION,CERRADO
2606,2742,Invitado informa que se descontó el monto de s/800.00 de su saldo. Se informa que el monto ha sido apostado en el juego 3D Roulette // indica no reconocer apuesta // solicita se revise su caso. ,SOPORTE,CERRADO
2607,2743,Invitada no recibió bonos del programa Embajador Atlantic por las 3 primeras recargas de su referida.   NOMBRE DE REFERIDA: Sheilla Rivera Ramirez  Importe de la 1era recarga: 100 soles   Importe de la 2da recarga:  100 soles  Importe de la 3era recarga: 200 soles  El importe a reclamar sería 10% de la 1era recarga + 15% de la 2da recarga + 20% de la 3era recarga.= 65 soles.  Se adjunta pantallazo de los depósitos de la referida.,VENTAS - SOPORTE,CERRADO
2608,2744,Invitada intenta ingresar el código TORPRA20PENF2###0a617 pero le arroja error // se adjunta imagen. ,CONTROL Y GESTION - VENTAS - SOPORTE,CERRADO
2609,2745,Invitado solicita el cierre definitivo de su cuenta // además de prohibirle el ingreso al casino físico. Se procedió a llamarlo ya que correo remitente no coinside con el registrado.  Invitado confirma el cierre. Motivo: indica que las máquinas están arregladas y le estamos robando. Desiste de saldo actual.  Se adjunta foto de correo. ,SOPORTE,CERRADO
2610,2746,Invitada envía correo solicitando el cierre de su cuenta ya que pierde mucho.   Se adjunta correo de invitada. ,SOPORTE,CERRADO
2611,2747,Invitado solicita el cierre de su cuenta por motivos personales. Se verifica que tiene un bono activo de S/175.00. Invitado confirma vía llamada que desiste de bono actual.  Se adjunta foto de correo. ,SOPORTE,CERRADO
2612,2748,Mozilla/5.0 (Macintosh // Intel Mac OS X 10_15_6) AppleWebKit/605.1.15 (KHTML // like Gecko) Version/15.0 Safari/605.1.15 Toda la mañana no funciona el juego se comió todo el dinero  Servicio | Oryx Mobile - Slots Sala |  Midnight Eclipse Mobile Cantidad | NO RECLAMA MONTO ,CONTROL Y GESTION,CERRADO
2613,2749,Invitado indica que 11.56pm del 25/10 recarga su bono de 300 soles  // pero tenia un retiro pendiente que al aprobarse de elimino el codigo // por favor pide que revisen su caso.  codigo: BP300PENF16###5f6aa4,CONTROL Y GESTION - SOPORTE,CERRADO
2614,2750,Invitado solicita la reactivación de su cuenta // se confirma que envía solicitud desde correo registrado. Se adjunta imagen.,SOPORTE,CERRADO
2615,2751,Invitada envía correo solicitando el cierre de su cuenta. Se adjunta imagen del correo.,SOPORTE,CERRADO
2616,2752,Invitado solicita el cierre definitivo por motivos personales // se recalca que perderá los beneficios ganados y se consulta si desiste del saldo actual en cuenta de S/1 // responde correo indicando que desiste de ello.  Dato adicional: Invitado ya ha cerrado y reabierto cuenta en dos oportunidades.,SOPORTE,CERRADO
2617,2753,Invitado indica que apostó al número 21 // salió el número 21 y la ruleta seguía girando lentamente // hasta que el crupier levantó y dio giro lanzando sin haber pagado // sólo salió un mensaje de "Estamos revisando el vídeo" .El premio correspondía S/1125. Invitado indica que el juego era American Roulette // sin embargo en Alira figura Roulette Evolution Mobile. Verificamos que el 26/10/2021 a las 21:41:05 hrs dejó de jugar el juego de Roulette  // retoma juego a las 22:01:39 hrs y se brinda un premio de S/1125 a las 22:11:09hrs. // consultamos si éste sería el premio en cuestión // a lo que indica que corresponde a otra jugada. El pago que indica debió realizar a las 21:41 hrs aprox por la apuesta de S/75 Se adjunta imagen de invitado y excel donde se visualiza que no se realiza pago.  ,CONTROL Y GESTION - SOPORTE,CERRADO
2618,2754,Invitado comunica por chat que estuvo interactuando en el juego Megaways Jack Mobile y que en su ultima apuesta de 88 dolares el juego le dio FREE SPINS y ya tenia acumulado 240 dolares de ganancia pero casi al final de los juegos se presento una falla y al reingresar al juego se dio cuneta que perdió el monto ganado y la ultima vuelta de las jugadas gratis. Invitado comunica que esto ya le ha sucedido antes pero al reingresar el juego cargaba normal pero en esta ocasión no ha sucedido. Invitado no tiene imagenes.,CONTROL Y GESTION,CERRADO
2619,2755,invitada envía correo para cierre de cuenta,SOPORTE,CERRADO
2620,2756,invitada envía correo para cierre de cuenta y no desea mas comunicación por parte del casino por ningún medio.,SOPORTE,CERRADO
2621,2757,Invitada solicita el cambio de usuario // no especifica el porqué. Se procedió a llamarla para validar sus datos // se corrobora que sí es la misma invitada quien solicita la modificación.  Nuevo usuario a cambiar: Fénix91 Se adjunta foto de chat. ,SOPORTE,CERRADO
2622,2758,invitado envía correo solicitando cierre de cuenta-,SOPORTE,CERRADO
2624,2760,Informa que se encontraba jugando cuando le apareció un bonuso de 200 (un poco más) y un multiplicador de  "x50" // indica: "el problema es que el juego sólo me pagó 6mil y cerro el bonus (aún me quedaban tiradas gratis) // no hay que ser "pro" en matemáticas para darse cuenta q esa ganancia era de 10mil" solo le apareció un mensaje  "ud ha ganado 6mil...." Solicita revisen su caso ya que invitado considera que debió ganar 10mil y 6mil.  A las 17:17:47 obtuvo el premio // de adjunta imagen de Alira. ,CONTROL Y GESTION - SOPORTE,CERRADO
2626,2762,invitado indica que ha estado jugando mesas y en el rango de 9:45 y 10:30 le salian varios manos con diferentes bonos : escaleras  // por doble par // par de ases pero ninguna se le hizo pago efectivo  // no pudo tomar foto o imagen porque solo dura 2 segundos dicha imagen en la pantalla // pensó que solo en la primera es porque se le paso pero ya repetidamente pues no le parece. Desea que se verifique sus pagos entre la hora marcada del dia 29/10.,CONTROL Y GESTION - SOPORTE,CERRADO
2627,2763,Invitado menciona que al jugar le apareció el bonus y en las dos ultimas jugadas  // le apareció un error salió y volvió a ingresar y no se soluciono // menciona que el monto que iba ganando era de 82 soles promedio.,CONTROL Y GESTION - SOPORTE,CERRADO
2628,2764,Invitada envía correo solicitando la activación de su cuenta. Se adjunta imagen ,SOPORTE,CERRADO
